{
  "$schema": "https://json-schema.org/draft/2020-12/schema",
  "$id": "copy-payload.schema.json",
  "title": "stem-stuff Copy button payload (v1). See copy/COPY-PAYLOAD.md",
  "type": "object",
  "required": ["v", "code", "subject", "start", "copied", "final", "tries", "hints", "explain", "hist"],
  "additionalProperties": false,
  "properties": {
    "v": { "const": 1, "description": "payload schema version" },
    "code": { "type": "string", "pattern": "^(CALC1|CSCI26|PHYS)-[A-Z0-9]{3,6}$" },
    "subject": { "enum": ["CALC1", "CSCI26", "PHYS"] },
    "start": { "$ref": "#/$defs/iso", "description": "when the problem was opened; every t is seconds after this" },
    "copied": { "$ref": "#/$defs/iso" },
    "final": {
      "description": "last try, or null if none",
      "oneOf": [
        { "type": "null" },
        { "type": "object", "required": ["a", "v"], "additionalProperties": false,
          "properties": { "a": { "type": "string" }, "l": { "$ref": "#/$defs/letter" }, "v": { "$ref": "#/$defs/verdict" } } }
      ]
    },
    "tries": {
      "type": "array", "maxItems": 200,
      "items": { "type": "object", "required": ["t", "a", "v"], "additionalProperties": false,
        "properties": {
          "t": { "$ref": "#/$defs/t" },
          "a": { "type": "string", "maxLength": 500, "description": "what was typed; MC: the choice text" },
          "c": { "type": "string", "pattern": "^[a-z]$", "description": "MC choice id" },
          "l": { "$ref": "#/$defs/letter" },
          "v": { "$ref": "#/$defs/verdict" } } }
    },
    "hints": {
      "type": "array", "maxItems": 10,
      "items": { "type": "object", "required": ["t", "n", "kind"], "additionalProperties": false,
        "properties": { "t": { "$ref": "#/$defs/t" }, "n": { "type": "integer", "minimum": 1 }, "kind": { "type": "string", "pattern": "^[a-z]+(-[a-z]+)*$", "description": "error type from MC.md section 6, or nudge" } } }
    },
    "explain": { "type": "string" },
    "hist": {
      "type": "object", "required": ["n", "kept", "edits"], "additionalProperties": false,
      "properties": {
        "n": { "type": "integer", "minimum": 0, "description": "distinct snapshots recorded" },
        "kept": { "type": "integer", "minimum": 0, "description": "snapshots kept after thinning" },
        "edits": { "type": "array", "maxItems": 120,
          "items": { "type": "object", "required": ["t", "at", "del", "ins"], "additionalProperties": false,
            "properties": { "t": { "$ref": "#/$defs/t" }, "at": { "type": "integer", "minimum": 0 },
              "del": { "type": "integer", "minimum": 0 }, "ins": { "type": "string" } } } }
      }
    }
  },
  "$defs": {
    "iso": { "type": "string", "pattern": "^\\d{4}-\\d\\d-\\d\\dT\\d\\d:\\d\\d:\\d\\d(\\.\\d+)?Z$" },
    "t": { "type": "number", "minimum": 0 },
    "letter": { "enum": ["A", "B", "C", "D", "E"] },
    "verdict": { "enum": ["correct", "wrong", "invalid", "locked", "egg"] }
  }
}
